{
  "artifact_size_bytes": 9644932,
  "automatic_promotion_permitted": false,
  "blocked_gates": [
    "6E3",
    "6F",
    "6G"
  ],
  "calibration_performed": true,
  "calibration_residual_row_count": 70935,
  "canonical_device": "cpu",
  "configuration_count": 9,
  "configuration_ids": [
    "expanding_all",
    "rolling_672",
    "rolling_2688",
    "aci_672_0p005",
    "aci_672_0p01",
    "aci_672_0p02",
    "aci_2688_0p005",
    "aci_2688_0p01",
    "aci_2688_0p02"
  ],
  "confirmatory_evaluation_performed": false,
  "contract_version": "1.0.0",
  "coverage_levels": [
    0.8,
    0.9,
    0.95
  ],
  "execution_commit": "f5c5cfe59416aa5c247c2aa84fcc7fa188143f63",
  "external_api_cost_usd": 0.0,
  "gate": "6E",
  "human_decision_required": true,
  "interval_prediction_row_count": 63036,
  "intervals_generated": true,
  "locked_predictions_parsed": false,
  "locked_test_accessed": false,
  "locked_test_start": 28032,
  "maximum_prediction_origin": 28027,
  "maximum_target_dependency": 28028,
  "next_gate": "6E3",
  "next_gate_authorized": false,
  "optimization_executed": true,
  "outer_fold_count": 4,
  "output_hashes": {
    "calibration_lineage": "676e51a01355de83bf1ab48c13cc78b3317b9b3730fbd2bbee128998206a9788",
    "calibration_residuals": "d3eaada10d46943f5d43e4bb7241f7e7cf1f9a478949a81288ae7eefabbb5671",
    "configuration_results": "8e7983a62b19a7db3b28ee4dde737c84da904901323c107ad9554434ed82363b",
    "coverage_results": "f16f446f7ad0e7ee75e2f67484a7c2f079c6ebaf348f4a7eba7105ce8be0cf20",
    "environment_lock": "3ca17e004e834bbdbf179bb65f900f7262f8e17e36d7dac7e4a727a7952ecd07",
    "failure_records": "43015d661be209054315b787c7e4c060b673de74381442b51ba56583927f5b09",
    "interval_predictions": "fdd3f7155265ac42228984a8647be1c5a62f3b6d1a57cb308294752410f4598d",
    "outer_fold_results": "b53bcd5f99f56462ebebff397b49b4337b68317f8ccf7d27c24366e2d4cd0106",
    "promotion_recommendation": "6af4c7aed41adffc5aa725d666de3df572b3646aa4863c391583aada553364e0",
    "resource_evidence": "98656912f840acff766bc1ec6eea91b8464fb31a31784f0bda34aa1b2159df96"
  },
  "peak_memory_mb": 263.5546875,
  "point_model_mutated": false,
  "point_model_search_performed": false,
  "point_prediction_parity_violation_count": 0,
  "probabilistic_authority_claimed": false,
  "recommendation_outcome": "no_action",
  "recommended_configuration": null,
  "retained_point_model": "v1_frozen_champion",
  "schema_version": "1.0.0",
  "status": "validation_complete_pending_human_decision",
  "subgate": "6E2",
  "total_wall_clock_seconds": 67.09702679999998,
  "uncertainty_metrics_calculated": true,
  "v1_immutable": true,
  "validation_origins_per_configuration": 7004
}
